dominant_topic_label,early_share,late_share,change_pct_points
"T0: business, time, help, real",0.7517321016166282,0.838501291989664,8.68
"T4: chat, gpt, chat gpt, used",0.03464203233256351,0.040195233993683605,0.56
"T5: free, free praise, praise, paid",0.04503464203233257,0.03818547229399943,-0.68
"T1: course, completed, complete, interested",0.042725173210161664,0.022968705139247775,-1.98
"T3: understand, easy, easy understand, simple",0.0687066974595843,0.04220499569336779,-2.65
"T2: clear, wish, understandable, clear understandable",0.05715935334872979,0.017944300890037325,-3.92
